حوادث روزهای آخر در ایران تمام جهان‌را به خود جلب نموده,ҳаводиси рӯзҳои охар дар эрон тамоми ҷаҳонро ба худ ҷалб намуда
مطمئنم که مردم تاجیکستان هم از احوال ایران نگران هستند,мутмаъинам ки мардуми тоҷикистон ҳам аз аҳволи эрон нигарон ҳастанд
اینجانب شخصاً هم خیلی نگران اوضاع ایران هستم,инҷониб шахсан ҳам хеле нигарони авзоъи эрон ҳастам
به خاندان هشت نفر کشته شده تسلی عرض می‌کنم,ба хонадони ҳашт нафари кушта шуда тасаллият арз мекунам
این‌ها جوانانی بودند که فقط می‌خواستند از خقوق خود و حقوق ملت ایران دفاع نمایند,инҳо ҷавононе буданд ки фақат мехостанд аз ҳуқуқи худ ва аз ҳуқуқи миллати эрон дифоъ кунанд
شاید بسیاری‌ها با خواندن آخرین نگارش بنده روی تارنگار فکر کردند که من از این یا آن نامزد پشتبانی می‌کنم که قطعاً این گونه نیست,шояд бисёриҳо бо хондани охарин нигориши банда рӯйи торнигор фикр карданд ки ман аз ин ё он номзад пуштибонӣ мекунам ки қатъан ин гуна нест
بنده مدافع کوچک ملت وشکوه و حشمت ملت ایران منظور از تمام ایرانیان یا خود تاجیکان است هستم و همچنین مدافع کوچک استقلال ملت هستم,банда мудофеъи кӯчаки миллат ва шукӯҳу ҳашамати миллати эрон манзур аз тамоми эрониён ё худ тоҷикон аст ҳастам ва ҳамчунин мудофеъи кӯчаки истиқлоли миллат ҳастам
متاسفانه تاریخ سرزمین ما نشان داده که چنین اتفاقاتی فراوانی افتاده که بیگانگان دست خودرا به مرز و بوم ما دراز می‌کنند و هر گونه بی نظامی‌هارا در کشور جاری می‌نمایند,мутаасифона торихи сарзамини мо нишон дода ки чунин иттифоқоти фаровоне уфтода ки бегонагон дасти худро ба марзу буми мо дароз мекунанд ва ҳар гуна бе низомиҳоро дар кишвар ҷорӣ менамоянд
همین است که تا آن زمانی که دلائل بیشتری مبنی بر تقلبات در انتخابات ندیدم چیزی زیادی در این باره نگفتم,ҳамин аст ки то он замоне ки далоили бештаре мабнӣ бар тақаллубот дар интихобот надидам чизи зиёде дар ин бора нагуфтам
شوربختانه به نظر می‌آید که تقلبات در این انتخابات در واقع رخ داده,шӯрбахтона ба назар меояд ки тақаллубот дар ин интихобот дар воқеъ рух дода
البته نمی‌توان مطمئن بود که این پیروز واقعی‌را می‌تواند تغییر دهد یا خیر,албатта наметавон мутмаъин буд ки ин пирӯзи воқеъиро метавонад тағйир диҳад ё хайр
امیدوارم که اوضاع در ایران آرام گردد و همچنین به آرای مردم احترام گذاشته شود,умедворам ки авзоъ дар эрон ором гардад ва ҳамчунин ба орои мардум эҳтиром гузошта шавад
به نظر اینجانب در واقع برگذاری انتخابات مجدد در کشور بهترین راه است تا تمام شبهه‌ها برطرف گردند,ба назари инҷониб дар воқеъ баргузории интихоботи муҷаддад дар кишвар беҳтарин роҳ аст то тамоми шубҳаҳо бартараф гарданд
به نظر می‌رسد در چارچوب قانون اساسی جمهوری اسلامی بسیار تخلفاتی در روند انتخابات به وقوع پیوسته,ба назар мерасад дар чорчӯби қонуни асосии ҷумҳурии исломӣ бисёр тахуллуфоте дар раванди интихобот ба вуқӯъ пайваста
امروز شورای نگهبان قانون اساسی جمهوری اسلامی ایران هم اعلام نموده که قضیه‌را بررسی خواهد نمود,имрӯз шӯрои нигаҳбони қонуни асосии ҷумҳурии исломии эрон ҳам эълом намуда ки қазияро баррасӣ хоҳад намуд
سخنگوی شورای نگهبان عباس علی کدخدایی هم امروز اعلام نموده که برگزاری انتخابات مجدد از احتمال دور نیست که واقعاً امیدبخش است,сухангӯйи шӯрои нигаҳбон аббос алии кадхудоӣ ҳам имрӯз эълом намуда ки баргузории интихоботи муҷаддад аз эҳтимол дур нест ки воқеъан умедбахш аст
مردم تاجیکستان در واقع باید ملت‌دوستی و میهن‌دوستی‌را از همقومان داخل مرز ایران امروزی یاد بگیرند,мардуми тоҷикистон дар воқеъ бояд миллатдӯстиву меҳандӯстиро аз ҳамқавмони дохили марзи эрони имрӯзӣ ёд бигиранд
این جوانان بیدار از رای خود از رای ملت خود – از حقوق ملت دفاع می‌کنند,ин ҷавонони бедор аз раъйи худ аз раъйи миллати худ – аз ҳуқуқи миллати дифоъ мекунанд
در حالی که روشن نیست چه اتفاقی افتاده این جوانان به خیابان‌ها ریختند تا از دولت تقاضا نمیاند که این قضیه روشن گردد,дар ҳоле ки рӯшан нест чӣ иттифоқе уфтода ин ҷавонон ба хиёбонҳо рехтанд то аз давлат тақозо намоянд ки ин қазия рӯшан гардад
بنده به هیچ وجه از خشونت پشتبانی نمی‌کنم بلکه از بیداری,банда ба ҳеч ваҷҳ аз хушунат пуштибонӣ намекунам балки аз бедорӣ
معترضان هم حداقل عکثریت کل آنان خشونت نمی‌خواهند و تنها می‌خوهند به رای آن‌ها احترام گذاشته شود,мӯътаризон ҳам ҳаддиақал аксарияти кулли онон хушунат намехоҳанд ва танҳо мехоҳанд ба раъйи онҳо эҳтиром гузошта шавад
جوانان ایران در واقع بیدارند و وطن‌دوستند که روز انتخابات به پای صندوق‌های رای ریختند و پس به خیبان‌ها هم ریختند,ҷавонони эрон дар воқеъ бедоранд ва ватандӯстанд ки рӯзи интихобот ба пойи сандуқҳои раъй рехтанд ва пас ба хиёбонҳо ҳам рехтанд
البته در این حالت برخورد نیروهای انتظامی بسیار شگفت‌آور است که با جوانان کشور خود چنین برخورد می‌نمایند,албатта дар ин ҳолат бархурди нерӯҳои интизомӣ бисёр шигифтовар аст ки бо ҷавонони кишвари худ чунин бурхурд менамоянд
امید دیگر این است که نیروهای بیگانه هیچ اقدامی نکنند,умеди дигар ин аст ки нерӯҳои бегона ҳеч иқдоме накунанд
این قضیه‌ی داخلی ایران است و امید بر خدای‌را که معترضان هم هوشیار خواهند بود که دست نیروهای بیگانه به ایران عزیز نرسد,ин қазияи доҳилии эрон аст ва умед бар худойро ки мӯътаризон ҳам ҳушёр хоҳанд буд ки дасти нерӯҳои бегона ба дасти эрони азиз нарасад
زنده باد ایران,зинда бод эрон
دوشنبه خرداد,душанбе хурдоди
از زمان انقلاب فرهنگیان و واردبکاران در باره‌ی فروریزی نظام ایران پیشگویی می‌کردند,аз замони инқилоб фарҳангиён ва воридбакорон дар бораи фурӯрезии низоми эрон пешгӯӣ мекарданд
این هفته هم پیشگویی بهتری نکردند,ин ҳафта ҳам пешгӯии беҳтаре накарданд
عباس برزگر,аббоси барзагар
برگرفته از گاردین,баргирифта аз гордиён
من دقیقاً یک هفته در ایران در حال پوشش کارناوال انتخاباتی هستم,ман дақиқан як ҳафта дар эрон дар ҳоли пӯшиши корноволи интихоботии ҳастам
از روزی که به این جا رسیدم اندک اشخاسی شک داشتند که رییس جمهور فتنه‌انگیز فعلی ایران پیروز خواهد شد,аз рӯзе ки ба ин ҷо расидам андак ашхосе шак доштанд ки раиси ҷумҳури фитнаангези феълии эрон пирӯз хоҳад шуд
راننده‌ی تاکسی‌ام به من یادآوری نمود که رییس جمهور در چهار سال گذشته از هر یک استان دو باری دیدار نموده – ایران تهران نیست گفت او,ронандаи токсиам ба ман ёдоварӣ намуд ки раиси ҷумҳур дар чаҳор соли гузашта аз ҳар як устон ду бор дидор намуда – эрон теҳрон нест гуфт ӯ
حتا وقتی من با حامیان موسوی این پرسش‌را مطرح می‌نمودم پاسخ آنان پر از نیک‌اندیشی شرطی اوبامایی بود – آری ما می‌توانیم امیدوارم اگر شما رای بدهید,ҳатто вақте ман бо ҳомиёни мӯсавӣ ин пурсишро матраҳ менамудам посух онон пур аз некандешии шартии убомоӣ буд – оре мо метавонем умедворам агар шумо раъй бидиҳед
پس پرسش چه گونه موسوی باخت,пас пурсиши чӣ гуна мӯсавӣ бохт
که رسانه‌های بین الملل‌را سرگرم کرده به نظر می‌آید که کمتر مشکل کمیته‌ی انتخابات و بیشتر مشکل درک بد که ریشه در سرپیچی سرسخت درک نقش مذهب در ایران است,ки расонаҳои ғарбро саргарм карда ба назар меояд ки камтар мушкили кумитаи интихобот ва бештар мушкили дарки бад ки реша дар сарпечии дарки нақши мазҳаб дар дар эрон аст
البته امکان واقعی تقلب آرا وجود دارد و باید منتظربماند تا این اتهامات آشکار ‌شوند,албатта имкони воқеъии тақаллуби оро вуҷуд дорад ва бояд мунтазир бимонд то ин иттиҳмот ошкор шаванд
ولی باید یادآور شد که در سه دهه‌ی انتخابات ریاست جمهوری اتهامات تقلب علیه شمار آرا کمسابقه بوده,вале бояд ёдовар шуд ки дар се даҳаи интихоботи раёсати ҷумҳурӣ иттиҳомоти тақаллуб алайҳи шумори оро камсобиқа буда
انتخابات در این جا معمولاً از طریق رد صلاحیت نامزدها یا با بستن روزنامه‌های مخالف نظارت می‌شود,интихобот дар ин ҷо маъмулан аз тариқи радди салоҳияти номзадҳо ё бо бастани рӯзномаҳои мухолиф назорат мешавад
گذشته از آن در این انتخابات دو ناظر دولتی افزون بر مشاهدان از هر جناح شرکت داشتند تا تقلب دستجمعی‌را پیش‌گیری نمایند,гузашта аз он дар ин интихобот ду нозири давлатӣ афзун бар мушоҳидон аз ҳар ҷиноҳ ширкат доштанд то тақаллуби дастиҷамъиро пешгирӣ намоянд
ناباوری احساساتیی که حامیان موسوی همچون دلیل فساد دولتی ابراز نمودند باید با ناباوری برابری از امکان چنین فساد گسترده‌ای در روز روشن برخورد شود,нобоварии эҳсосотие ки ҳомиёни мӯсавӣ ҳамчун далели фасоди давлатӣ иброз намуданд бояд бо нобоварии баробаре аз имкони чунин фасоди густурдае дар рӯзи рӯшан бархурд шавад
پس تا آن زمانی که دلیل قوی که اتحامات اردوگاه مخالفان‌را دستگیری نماید ظاهر نگردد ما باید به دیگر برهان‌هایی روی آوریم که چرا این همه افراد از رویداد آن روز شگفت‌زده شده‌اند,пас то он замоне ки далели қавӣ ки иттиҳомоти урдугоҳи мухолифонро дастгирӣ намояд зоҳир нагардад мо бояд дигар бурҳонҳое рӯй оварем ки чаро ин ҳама афрод аз рӯйдоди он рӯз шигифтзада шудаанд
تا آن جایی که به پوشش رسانه‌های بین المللی ربط دارد اندیشه‌ایی پر از آرزو بر گذارشگری معتبر سایه افگند,то он ҷое ки ба пӯшиши расонаҳои байнулмиллалӣ рабт дорад андешагарии пур аз орзу бар гузоришгарии мӯътабар соя афганд
درست است که حامیان موسوی ترافیک تهران‌را هفته‌ی گذشته هر شب در طول ساعت‌ها شلوغ می‌کردند اگرچه کمتر یادآور می‌شد که این اتفاق در بخش‌های شمالی و ثروتمند پایتخت می‌افتاد,дуруст аст ки ҳомёни мӯсавӣ терофики теҳронро ҳафтаи гузашта ҳар шаб дар тӯли соатҳо шулуғ мекарданд агарчӣ камтар ёдовар мешуд ки ин иттифоқ дар бахшҳои шимолӣ ва сарватманди пойтахт меуфтод
بانوان روسری‌اشان‌را کمی پایین می‌آوردند و مردان جوان در خیابان‌ها می‌رقصیدند,бонувон рӯсариашонро каме поин меоварданд ва мардони ҷавон дар хиёбонҳо мерақсиданд
شب روز دوشنبه حداقل از حامیان نخستوزیر پیشین زنجیره‌ی انسانیی‌را از وسط تهران ساختند,шаби рӯзи душанбе ҳадди ақал аз ҳомиёни нахуствазири пешин занҷираи инсониеро аз васати теҳрон сохтанд
اما ساعاتی پیش من در گردهمایی برای رییس جمهور فعلی حضور داشتم که از طریق رسانه‌های غربی پوشش کم یا هیچ پوششی درنیافت,аммо соъоте пеш ман дар гирдиҳамоие барои раиси ҷумҳури феълӣ ҳузур доштам ки тариқи расонаҳои ғарбӣ пӯшиши кам ё ҳеч пушише дарнаёфт
به این خاطرکه به علت پرجمعیتی در این گردهمایی او آقای احمدی‌نژاد به داخل تالار درآمده نتوانست تا سخنرانی نماید,ба ин хотир ки ба хотири пурҷамъиятӣ дар ин гирдиҳамоӣ ӯ оқои аҳмадинажод ба дохили толор даромада натавонист то суханронӣ намояд
براوردهای حداقل جمعیت در این گردهمایی گفته شده علاقه‌مندان شماره‌را به یک ملیون می‌رسانند,баровардҳои ҳаддиақали ҷамъият дар ин гирдиҳамоӣ гуфта шуда алоқамандон шумораро ба як милюн мерасонанд
من از بالای بام مشاهده می‌نمودم که بانوان چادری و مردان ریش‌دار هر سن و سال گله گله به آن جا می‌ریختند,ман аз болои бом мушоҳида менамудам ки бонувони чодарӣ ва мардони ришдори ҳар синну сол гала-гала ба он ҷо мерехтанд
ولی ناتوانی آزمایش درست امور ایران به هیچ وجه پدیده‌ی تازه‌ا‌ی نیست,вале нотавонии озмоиши дурусти умури эрон ба ҳеч ваҷҳ падидае тозае нест
وقتی انقلاب سال دیکتاتوری نظامی قوی‌ترین متحد آمریکا در منطقه‌را سرنگون نمود اندکی از کارشناسانی که بیرون از کشور بودند حدس می‌زدند که جریان اسلامی به حیث حزب پیشتاز به میان آید,вақте инқилоби соли диктотурии низомии қавитарин муттаҳиди омрико дар минтақаро сарнагун намуд андаке аз коршиносоне ки берун аз кишвар буданд ҳадс мезаданд ки ҷараёни исломӣ ба ҳайси ҳизби пештоз ба миён ояд
ولی در ایران حتا روشنفکر دهری سکولار جلال آل‌احمد نویسنده‌ی کتاب بدنام غربزدگی فروریزی رژیم بر دست جنبش اسلامی‌را بیشتر از یک دهه تا حوادث مهم پیشگویی کرده بود,вале дар эрон ҳатто рӯшанфикри даҳрӣ секулор ҷалол оли аҳмад нависандаи китоби бадноми ғарбзадагӣ фурӯрезии режим бар дасти ҷунбиши исломиро бештар аз як даҳа то ҳаводиси муҳими пешгӯйӣ карда буд
وقتی فیلسوف مستقل فروانسوی میشل فوکو هم درست حدث زد وقتی از خیابان‌ها گذارش می‌داد – بینیشی که تا به حال بسیاری از هوادارانش از آن خودرا دور می‌گیرند,вақте файласуфи мустақили фаронсавӣ мишел фуку ҳам дуруст ҳадс зад вақте аз хиёбонҳо гузориш медод – бинише ки то ба ҳол бисёре аз ҳаводоронаш аз он худро дур мегиранд
از زمان انقلاب فرهنگیان و واردبکاران در باره‌ی فروریزی نظام ایران پیشگویی می‌کردند,аз замони инқилоб фарҳангиён ва воридбакорон дар бораи фурӯрезии низоми эрон пешгӯӣ мекарданд
این هفته هم پیشگویی بهتری نکردند,ин ҳафта ҳам пешгӯии беҳтаре накарданд
چنین اتفاقات خلاف قاعده‌ای‌را تنها می‌توان از طریق عقیده‌ی تاریخی که می‌کوشد دموکراسی مدرن‌را بر پایه‌ی حکمرانی‌های صده‌های گذشته درک نماید شرح داد,чунин иттифоқоти хилофи қоидаиро танҳо метавон аз тариқи ақидаи торихӣ ки мекӯшад демукросии мудернро бар пояи ҳукмрониҳои садаҳои гузашта дарк намояд шарҳ дод
جامعه‌ی ایران جامعه‌ی عمیقاً مذهبی‌ست,ҷомеаи эрон ҷомеаи амиқан мазҳабист
کمونیستان و لیبرال‌ها با اشتباهات شاه همچون خویش‌ و تبارپرستی حکومت مطلق و سرکوبی‌‌را ده‌ها سال بدون هیچ کامیابی جنگیدند,кумунистон ва либеролҳо бо иштибоҳоти шоҳ ҳамчун хешу таборпарастӣ ҳукумати мутлақ ва саркӯбиро даҳҳо сол бидуни ҳеч комёбӣ ҷангиданд
حمله‌ی او به دین بود که منجر به شکست تقریباً شبانه‌ای شاه شد,ҳамлаи ӯ ба дин буд ки мунҷар ба шикасти тақрибан шабонаии шоҳ шуд
از آن پس ایرانیان معمولی آرمان‌های خویش‌را از طریق صندوق رای بکار برده‌اند,аз он пас эрониёни маъмулӣ ормонҳои хешро аз тариқи сандуқи раъй ба кор бурдаанд
سال زمانی که خاکستر جنگ ایران و عراق نشست و کشور دهه‌ی اثتواری نسبی‌را دید رای‌دهندگان توده توده برای پشتبانی از رییس جمهور پیشین و روحانی خاتمی دربرابر ناطق نوری از اعضای ارشد دستگاه برآمدند,соли замоне ки хокистари ҷанги эрону ироқ нишасту кишвар даҳаи устувории нисбиро дид раъйдиҳандагони тӯда барои пуштибонӣ аз раиси ҷумҳури пешин ва рӯҳонӣ хотамӣ дар баробари нотиқи нурӣ аз аъзои аршади дастгоҳ баромаданд
خبرنگاران غربی این‌را همچون جدایی بزرگ بین جوانان آزادی‌دوست لیبرال در برابر روحانیان محافظه‌کار کهن‌سال دیدند,хабарнигорони ғарбӣ инро ҳамчун ҷудоии бузург байни ҷавонони озодидӯсти либерол дар баробари рӯҳониёни муҳофизакори кӯҳансол диданд
ولی در حقیقت این رای برای آرمان راستکاری و پارسایی ضد اتحامات فساد گسترده بود,вале дар ҳақиқат ин раъй барои ормони росткорӣ ва порсоӣ зидди фасоди густурда буд
بسیاری از همان حامیان خاتمی دیروز به احمدی‌نژاد رای دادند,бисёре аз ҳамон ҳомиёни хотамӣ дирӯз ба аҳмадинажод раъй доданд
با وجود این که تصویر خاتمی روی هر کدام از اعلان‌های لوحه‌های تبلغاتی موسوی‌را آرایش می‌داد,бо вуҷуди ин ки тасвири хотамӣ аз рӯйи ҳар кадом аз аълонҳо лавҳаҳои таблиғотӣ-и мӯсавиро ороиш медод
بیشتر از یک هفته همان انگیزه‌های ضد فساد پوپولیسم و پارسایی مذهبی که به انقلاب رسانید در دسترسی هر کسی که می‌خواست از آن گذارش نماید بود,бештар аз як ҳафта ҳамон ангезаҳои зидди фасод пупулисм ва порсоии мазҳабӣ ки ба инқилоб расонид дар дастрасии ҳар касе ки мехост аз он гузориш намояд буд
احمدی‌نژاد برای بسیاری در کشور مجسم همان آرمان‌هاست,аҳмадинажод барои бисёре дар кишвар муҷассами ҳамон ормонҳост
