روز فوریۀ سال این روزنامه خبر می‌دهد که حکومت بوش بوش اول خواستار سرعت بخشیدن به تعیین سفیر‌های جدید به کشور‌های قفقاز و آسیای میانه است تا از آرزو‌های ایران در منطقه جلو گری نماید,рӯзи феврийе феврал-и соли ин рӯзнома хабар медиҳад ки ҳукумати буш буши аввал хостори суръат бахшидан ба таъини сафирҳои ҷадид ба кишварҳои қафқоз ва осиёи миёна аст то аз орзуҳои эрон дар минтақа ҷилавгирӣ намояд
مطلب ذکر می‌نماید که ایران حامی تروریسم در جهان است و به جهان خطر می‌بخشد,матлаб зикр менамояд ки эрон ҳомии терурисм дар ҷаҳон аст ва ба ҷаҳон хатар мебахшад
طبق اطلاع حکومت آمریکا ایران خریدار موشک و بومب‌های هسته ای در منطقه است که بازمانده‌های شوروی هستند,тибқи иттилоъи ҳукумати омрико эрон харидори мушак ва бумбҳои ҳастаӣ дар минтақа аст ки бозмондаҳои шӯравӣ ҳастанд
مطلب همچنین می‌نویسد که خوشبختانه عکثر این کشور‌ها از لحاظ زبان و فرهنگ ترکند نه پارس و از لحاظ مذهب سنی هستند نه شیعه,матлаб ҳамчунин менависад ки хушбахтона аксари ин кишварҳо аз лиҳози забон ва фарҳанг турканд на порс ва аз лиҳози мазҳаб суннӣ ҳастанд на шиъа
تقریباً هفته ای پس روز فوریه رئیس جمهور بوش با نخستوزیر ترکیه سلیمان دمیرل sü در مورید عراق و رژیم صدام حسین دیدار و ملاقات می‌نماید,тақрибан ҳафтае пас рӯзи феврийе раиси ҷумҳур буш бо нахуствазири туркия сулаймон демирел sü дар мавриди ироқ ва режими саддом ҳусейн дидору мулоқот менамояд
در این دیدار طرفین راجع به آسیای میانه نیز گفتگو می‌نمایند,дар ин дидор тарафайн роҷеъ ба осиёи миёна низ гуфтугӯ менамоянд
آمریکا خواستار آن است که ترکیه‌را به عونان نمونۀ توسعه به آسیای میانه معرفی نماید,омрико хостори он аст ки туркияро ба унвони намунаи тавсиъа ба осиёи миёна муъаррифӣ намояд
آقای دمیرل می‌گوید آسیای میانه به بنیادگرایی اسلامی رو نخواهد آورد چون آن‌ها کشور‌های آسیای میانه کشور‌های ترک زبانند,оқои демирел мегӯяд осиёи миёна ба бунёдгароии исломӣ рӯ нахоҳад овард чун онҳо кишварҳои осиёи миёна кишварҳои туркзабонанд
از نظر تاریخی و فرهنگی آن‌ها ترکیه‌را همچون نمونه می‌شناسند,аз назари торихию фарҳангӣ онҳо туркияро ҳамчун намуна мешиносанд
او همچننین تصمیم گذرش به دبیرۀ لاتین از طرف برخی از این کشور ها‌را همچون قدم مهم ارزیابی می‌نماید,ӯ ҳамчунин тасмими гузариш ба дабираи лотин аз тарафи бархе аз ин кишварҳоро ҳамчун қадами муҳим арзёбӣ менамояд
روزی پس از این مطلب گزارش از سفر وزیر امر خارجۀ آمریکا جیمس بیکر به تاجیکستان نشر می‌گردد,рӯзе пас аз ин матлаб гузориш аз сафари вазири умури хориҷаи омрико ҷеймс бейкер ба тоҷикистон нашр мегардад
طبق این گزارش آمریکا نگران است که تاجیکستان اورانیوم خود‌را به ایران می‌تواند بفوروشد,тибқи ин гузориш омрико нигарон аст ки тоҷикистон уронийуми худро ба эрон метавонад бифурӯшад
رئیس جمهور رحمان نبیف اطمینان می‌دهد که تاجیکستان به هر کشوری اورانیوم خود‌را نخواهد فروخت,раиси ҷумҳур раҳмон набиев итминон медиҳад ки тоҷикистон ба ҳар кишваре уронийуми худро нахоҳад фурӯхт
آقای بیکر همچنین از روابط تاجیکستان و ایران نگرانی خود‌را اظهار می‌نماید و می‌گوید که ایجاد کردن دولت اسلامی اشتباه بزرگی خواهد بود,оқои бейкер ҳамчунин аз равобити тоҷикистону эрон нигаронии худро изҳор менамояд ва мегӯяд ки эҷод кардани давлати исломӣ иштибоҳи бузурге хоҳад буд
آقای نبیف اطمنان می‌دهد که ایران از نظر جغرافیایی به تاجیکستان نزدیکی دارد و به این دلیل خواستار رابطۀ خوب با ایران است ولی نه خود او و نه نخبۀ عمدتاٌ روسی زبان از پیام بنیادگرایی اسلامی خوشبین نیستند,оқои набиев итминон медиҳад ки эрон аз назари ҷуғрофиёӣ ба тоҷикистон наздикӣ дорад ва ба ин далел хостори робитаи хуб бо эрон аст вале на худи ӯ ва на нахбаи умдатан русӣ забон аз паёми бунёдгароии исломӣ хушбин нестанд
آقای بیکر همچنین خوش حال است که زبان کارگزاری در تاجیکستان نه فارسی بلکه روسیست,оқои бейкер ҳамчунин хушҳол аст ки забони коргузорӣ дар тоҷикистон на форсӣ балки русист
روز فوریه مطلب این روزنامه اطلاع می‌دهد که بهتر است عربستان سعودی در کشور‌های آسیای میانه نفوظ داشته باشد تا که ایران,рӯзи феврийе матлаби ин рӯзнома иттилоъ медиҳад ки беҳтар аст арабистони саъудӣ дар кишварҳои осиёи миёна нуфуз дошта бошад то ки эрон
جالب این جاست که امروز سلفی‌ها یا خود وهابی‌ها به جهان خطر می‌بخشند که از طرف عربستان سعودی پشتبانی می‌شوند,ҷолиб ин ҷост ки имрӯз салафиҳо ё худ ваҳҳобиҳо ба ҷаҳон хатар мебахашанд ки аз тарафи арабистони саъудӣ пуштибонӣ мешаванд
چونین ایران ستیزی در کل مطالب نیو یورک تایمز احساس می‌شود,чунин эронситезӣ дар кулли матолиби ню юрк тоймз эҳсос мешавад
پس از چند مطلب دیگر متوجه می‌شویم که جنگ در تاجیکستان آغاز شده,пас аз чанд матлаб дигар мутаваҷҷеҳ мешавем ки ҷанг дар тоҷикистон оғоз шуда
بالاخره یک نامه ای به دبیر روزنامه از پرفسور ریچارد فرای,билохира як номае ба дабири рӯзнома аз перуфесур ричорд ферой
از دانشگاه هاروارد که یک ایران شناس برجسته ای هست روز دسامبر نشر می‌شود,аз донишгоҳи ҳорворд ки як эроншиноси барҷастае ҳаст рӯзи десомбр декабр нашр мешавад
در این نامه دکتور فرای از مطالب نیو یورک تایمز راجع به آسیای میانه به ویژه تاجیکستان انتقاد می‌نماید,дар ин нома дуктур ферой аз матолиби ню юрк тоймз роҷеъ ба осиёи миёна бавижа тоҷикистон интиқод менамояд
او از جمله می‌نوسد,ӯ аз ҷумла менависад
من که در این کشور‌ها چندین سال زندگی کرده ام فکر نمی کنم که مردمان یا دولت‌های این کشور‌ها خواستار وسعت نفوذ خود یا نفوذ اسلام باشند,ман ки дар ин кишварҳо чандин сол зиндагӣ кардаам фикр намекунам ки мардумон ё давлатҳои ин кишварҳо хостори вусъати нуфузи худ ё нуфузи ислом бошанд
چیزی که آن‌ها بیشتر از همه می‌خواهند صلح و ثبات است و پارسان شیعه در صدد شیعه نمودن سنی‌های آسیای میانه نیستند,чизе ки онҳо бештар аз ҳама мехоҳанд сулҳу субот аст ва порсони шиъа дар садади шиъа намудани сунниҳои осиёи миёна нестанд
به جای سرزنش مسلمانان یا ایرانیان ما باید همکاری نمایم,ба ҷойи сарзаниши мусалмонон ё эрониён мо бояд ҳамкорӣ намоем
نامۀ دیگری به دبیر از یک فردی با نام رالف گروس روز فوریۀ سال چاپ می‌شود,номаи дигаре ба дабир аз як фарде бо номи ролф герувс рӯзи феврийеи соли чоп мешавад
نویسندۀ این نامه می‌گوید که او در دانشگاه کلومبیا افغانستان‌را آموخته و نه تنها خطر آن‌را می‌بیند که ایران در افغانستان در میان فارسیوان و هزاره‌ها و تاجیک‌ها نفوذ پیدا کند بلکه حتی در آن سوی رود در جمهوری پیشین شوروی تاجیکستان,нависандаи ин нома мегӯяд ки ӯ дар донишгоҳи куломбиё афғонистонро омӯхта ва на танҳо хатари онро мебинад ки эрон дар афғонистон дар миёни форсивону ҳазораҳову тоҷикҳо нуфуз пайдо кунад балки ҳатто дар он сӯйи руд дар ҷумҳурии пешини шӯравии тоҷикистон
این زنجرۀ ایرانی از ایران ازوسط غرب و شمال و شرق افغانستان تا تاجیکستان می‌تواند یک رابطۀ فرهنگی اجتمایی و سیاسی‌را ایجاد نماید,ин занҷираи эронӣ аз эрон аз васати ғарб ва шимолу шарқи афғонистон метавонад як робитаи фарҳангӣ иҷтимоӣ ва сиёсиро эҷод намояд
روز نوامبر مطلبی چاپ می‌شود با نام جهان,рӯзи нувомбр ноябр матлабе чоп мешавад бо номи ҷаҳон
بازی دومینو در آسیای میانه؛ چرا همۀ چشم‌ها بر جایی با نام تاجیکستان دوخته شده,бозии думину домино дар осиёи миёна чаро ҳамаи чашмҳо бар ҷойе бо номи тоҷикистон дӯхта шуда
در این مطلب آمده که اسلامگرایی در این کشور برای تمام جهان نگران کننده است,дар ин матлаб омада ки исломгароӣ дар ин кишвар барои тамоми ҷаҳон нигаронкунанда аст
همچنین آمریکا نگران از نفوظ ایران در این کشور است,ҳамчунин омрико нигарон аз нуфузи эрон дар ин кишвар аст
این مطالب بار دیگرثابت نمود که کشور‌های ابر قدرت خواهان ویران نمودن ایران هستند,ин матлаб бори дигар собит намуд ки кишварҳои абарқудрат хоҳони вайрон намудани эрон ҳастанд
آمریکا حالا از آغاز می‌دانست که تاجیکستان زبان و فرهنگ و نژاد ایرانی دارد,омрико ҳоло аз оғоз медонист ки тоҷикистон забону фарҳангиу нажоди эронӣ дорад
آمریکا و غرب به خاطر آن از ایرانیان می‌هراسند چون می‌داند که این کشور توانایی آن‌را دارد که به یک ابر قدرت تبدیل گردد,омрико ва ғарб ба хотири он аз эрониён меҳаросанд чун медонанд ки ин кишвар тавоноии онро дорад ки ба як абарқудрат табдил гардад
کشور ایران امروز تنها کشوریست در خاور میانه که سیاست مستقل‌را پیش گرفته و گرایش کشوری مثل تاجیکستان به ایران برای آمریکا نگران کننده است,кишвари эрон имрӯз танҳо кишварест дар ховари миёна ки сиёсати мустақилро пеш гирифта ва гароиши кишваре мисли тоҷикистон ба эрон барои омрико нигаронкунанда аст
این هفته می‌خواهم به موضوع تاجیکانی که مقم سرزمین تحت کنترول رژیم اشغالگرای ازبکستان هستند بپردازم,ин ҳафта мехоҳам ба мавзӯъи тоҷиконе ки муқими сарзамини таҳти кунтрули режими ишғолгарои ӯзбакистон ҳастанд бипардозам
این مساله برای همۀ ما ایرانی‌ها مهم است و رسیدگی زودهنگامی می‌خواهد,ин масъала барои ҳамаи мо эрониҳо муҳим аст ва расидагии зудҳангоме мехоҳад
در دوام دو سه روز آخر که به این مساله توجه نمودم بسیار اطلاعات تکان دهنده ای‌را پیدا کردم و برایم روشن شد که آن افکار و احساساتی که دارم پوچ و توخالی نیستند,дар давоми ду-се рӯзи охар ки ба ин масъала таваҷҷӯҳ намудам бисёр иттилоъоти такондиҳандаеро пайдо кардам ва барои рӯшан шуд ки он афкору эҳсосоте ки дорам пучу тухолӣ нестанд
مردم تاجیک از حقوق بنیانی خود بی بهره هستند,мардуми тоҷик аз ҳуқуқи бунёнии худ бе баҳра ҳастанд
طیق اطلاع سازمان مستقل حقوق بشر ازبکستان که در روزنامۀ نووایا پوکولنیه ی چاپ آلما آتی قزاقستان به طبع رسیده سال میلادی در شهر‌های سمرقند و بخارا مطابق فرامان وزارت آموزش و پرورش ازبکستان از سال کتاب‌ها به زبان فارسی یا خود تاجیکی خراب کرده شده اند,тибқи иттилоъи созмони мустақили ҳуқуқи башари ӯзбакистон ки дар рӯзномаи нувуё пукуление новое поколение-и чопи олмо отии қазоқистон ба табъ расида соли мелодӣ дар шаҳрҳои самарқанду бухоро мутобиқи фармони вазорати омӯзишу парвариши ӯзбакистон аз соли китобҳо ба забони форсӣ ё худ тоҷикӣ хароб карда шудаанд
تنها در یک مکتب سمرقند زیاده از کتاب درسی راجع به علوم تکنیکی و طبیعی خراب کرده شده است,танҳо дар як мактаби самарқанд зиёда аз китоби дарсӣ роҷеъ ба улуми текникӣ ва табиъи хароб карда шудааст
این روند در سراسر سرزمين هاي تحت كنترول اين رژيم تا امروز دوام دارد,ин раванд дар саросари сарзаминҳои таҳти кунтрули ин режим то имрӯз давом дорад
جمال میر سعید اف نمایندۀ سازمان مستقل حقوق بشر ازبکستان می‌گوید که در کتابخانۀ نزدیک منزلم حتی یک کتابی به زبان تاجیکی نیست,ҷамол мирсаидуф мирсаидов намояндаи созмони мустақили ҳуқуқи башари ӯзбакистон мегӯяд ки дар китобхонаи наздики манзилам ҳатто як китобе ба забони тоҷикӣ нест
بدترین چیز این است که شاه کتاب هایی از ابو علی سینا سعدی شکسپیر بایرون پوشکین,бадтарин чиз ин аст ки шоҳкитобҳое аз абу алӣ сино саъдӣ шекспир бойрун пушкин
خراب کرده می‌شوند که همۀ آن به زبان فارسی بود,хароб карда мешаванд ки ба ҳамаи он ба забони форсӣ буд
طبق این آمار در سمرقند تنها یک آموزشگاهی باقی مانده که در آن آموزش به زبان فارسیست و آن هم بخش زبان شناسی فارسی در دانشگاه سمرقند است,тибқи ин омор дар самарқанд танҳо як омӯзишгоҳе боқӣ монда ки дар он омӯзиш ба забони форсист форсии сирилик ва он ҳам бахши забоншиносии форсӣ дар донишгоҳи самарқанд аст
گذشته از این رژیم اشغال گرای ازبکستان به پاک سازیِ نژادی نیز دست زده است,гузашта аз ин режими ишғолгарои ӯзбакистон ба поксозии нажодӣ этническая чистка низ даст задааст
سال طبق اطلاع مقامات تاجیکستان رژیم اشغالگرای ازبکستان تقریباً تاجیک‌را به اتهام تروریسم و تندگرایی اسلامی از خانه‌های خود در استان سرخان دریا به مناطق دیگر اجباراً بیرون کرده است,соли тибқ иттилоъи мақомоти тоҷикистон режими ишғолгарои ӯзбакистон тақрибан тоҷикро ба иттиҳоми терурисм ва тундгароии исломӣ аз хонаҳои худ дар устони сурхондарё ба минтақаи дигар иҷборан берун кардааст
درد آورترین چیز این است که خود مردم تاجيكي كه تحت اين رژيم به سر مي برنددر روی این همه نقض حقوقشان خاموش هستند,дардовартарин чиз ин аст ки худ мардуми тоҷике ки таҳти ин режим ба сар мебаранд дар рӯйи ин ҳама нақзи ҳуқуқашон хомӯш ҳастанд
این به خاطر آن است که رژیم اشغالگرا با قویترین راه‌ها کوشش کرد مهرۀ مردم‌را بشکند,ин ба хотири он аст ки режими ишғолгаро бо қавитарин роҳҳо кӯшиш кард кард мӯҳраи мардумро бишканад
این دوام سیاست دراز مدت ازبکسازی رژیم است,ин давоми сиёсати дароз-муддати ӯзбаксозии ин режим аст
از زمان تشکل شدن جمهوری خودمختار شوروی سوسیالیستی ترکستان که سروران اساسی آن پان ترکست‌ها بودند ازبکسازی تاجیکان آغاز شد,аз замони ташкил шудан ҷумҳурии худмухтори шӯравии сусиёлистии туркистон ки сарварони асосии он пон туркистҳо буданд ӯзбаксозии тоҷикон оғоз шуд
طبق سرشماری سال جمعیت تاجیک در سمرقند و ازبک نفر بود,тибқи саршумории соли ҷамъияти тоҷик дар самарқанд ва ӯзбак нафар буд
سال جمعیت تاجیک و ازبک می‌شود,соли ҷамъияти тоҷик ва ӯзбак мешавад
بالاخره سال جمعیت تاجیک در سمرقند به و ازبک به می‌رسد,билохира соли ҷамъияти тоҷик дар самарқанд ба ва ӯзбак ба мерасад
گذشته از این مردم تاجیک یا خود ایرانی‌را باز هم بیشتر از هم جدا می‌نمایند و آن هایی که شیعه بودند فارس نامیده می‌شوند,гузашта аз ин мардуми тоҷик ё худ эронӣ-ро боз ҳам бештар аз ҳам ҷудо менамоянд ва онҳое ки шиъа буданд форс номида мешаванд
در حالی که این‌ها فرقی از یک دیگر نداشتند و یک ملت بودند و هستند,дар ҳоле ки инҳо фарқе аз як дигар надоштанд ва як миллат буданду ҳастанд
مگر غیر شیعه که در ایران سیاسی امروز زندگی می‌کنند ایرانی نیستند,магар ғайри шиъа ки дар эрони сиёсии имрӯза зиндагӣ мекунанд эронӣ нестанд
سال با بیداری ملی به ویژه در بین روشنفکران در سراسر اتحاد شوروی پیشین از جمله در سرزمین‌های تحت کنترول رژیم اشغالگرای ازبکستان جنبش‌های ملی گرایی ظاهر شدند,соли бо бедории миллӣ ба вижа дар байни рӯшанфикрон дар саросари иттиҳоди шӯравии пешин аз ҷумла дар сарзаминҳои таҳти кунтрули режими ишғолгарои ӯзбакистон ҷунбишҳои миллигароӣ зоҳир шуданд
این گروه کوشش می‌کرد که جمهوری خودمختار سغد ایجاد شود که تمام این سرزمین هارا در بر داشته باشد,ин гурӯҳ кӯшиш мекард ки ҷумҳурии худмухтори суғд эҷод шавад ки тамоми ин сарзаминҳоро дар бар дошта бошад
ولی با زور آوری‌های رژیم تحت اسلام کریمف این سازمان‌را ویران کردند,вале бо зӯровариҳои режим таҳти ислом каримуф каримов ин созмонҳоро вайрон карданд
اين رژيم با مقصد بر هم زدن احساسات ملی گرایانه در سرزمین زير کنترول خویش همچنین به سر تاجیکستان جنگی‌را تحمیل کرد,ин режим бо мақсади бар ҳам задани эҳсосоти миллигароёна дар сарзамини зери кунтрули хеш ба сари тоҷикистон ҷангеро таҳмил кард
با بهانۀ جنگ و اسلام گرایی در تاجیکستان او موفق شد که مرز تاجیکستان‌را با ازبکستان ببندد,бо баҳонаи ҷанг ва исломгароӣ дар тоҷикистон ӯ муваффақ шуд ки марзи тоҷикистонро бо ӯзбакистон бибандад
با بهانۀ مبارزه با تروریسم و افراط گرایی اسلامی گروه‌های آزادی خواه‌را از بین برد,бо баҳонаи мубориза бо терурисм ва ифротгароии исломӣ гурӯҳҳои озодихоҳро аз байн бурд
یکی از پیشوایان جمعیت تاجیکان در سمرقند حیات نیعمت به زندان افتاد و مورد شکنجه هم قرار گرفت,яке аз пешвоёни ҷамъияти тоҷикон дар самарқанд ҳаёти неъмат ба зиндон уфтод ва мавриди шиканҷа ҳам қарор гирифт
