در زمان پیش از انقلاب آوازهای داریوش و گوگوش و در دوره پس از انقلاب آهنگ‌های معین در سراسر کردستان عراق از طرفداران زیادی برخوردار بوده‌است,дар замони пеш аз инқилоб овозҳои дориюшу гугуш ва дар давраи пас аз инқилоб оҳангҳои муъин дар саросари курдистони ироқ аз тарафдорони зиёде бархурдор будааст
امروزه ویدئوکلیپ‌های معین با زیرنویس کردی در اینترنت با اشتیاق دست به دست می‌گردد,имрӯза видюкелипҳои муъин бо зернависи курдӣ дар интернет бо иштёқ даст ба даст мегардад
زمانی که بمباران‌های آمریکا و انتقام‌کشی صدام طی دو جنگ خلیج فارس باعث پناهنده‌شدن میلیون‌ها کرد عراقی به ایران شد بسیاری از کردها پس از شصت‌هفتاد سال دوباره با زبان فارسی تماس پیدا کردند,замоне ки бумборонҳои омрико ва интиқомкашии саддом тайи ду ҷанги халиҷи форс боиси паноҳанда шудани милюнҳо курди ироқӣ дар ба эрон шуд бисёре аз курдҳо пас аз шаст-ҳафтод сол дубора бо забони форсӣ тамос пайдо карданд
بسیاری با اقامت‌های چندین ماهه در ایران زبان فارسی‌را فراگرفتند و امروزه بخوبی به آن تکلم می‌کنند,бисёре бо иқоматҳои чандин моҳа дар эрон забони форсиро фаро гирифтанд ва имрӯза бахубӣ ба он такаллум мекунанд
تا اواخر دوران صدام زبان عربی همچنان سیطره خود‌را به عنوان زبان نوشتاری و زبان منبع در شمال عراق حفظ کرده‌بود ولی در دهه اخیر اوضاع دوباره دگرگون شده‌است,то авохири даврони саддом забони арабӣ ҳамчунон сайтараи худро ба унвони забони навишторӣ ва забони манбаъ дар шимоли ироқ ҳифз карда буд вале дар даҳаи ахир авзоъ дубора дигаргун шудааст
گزارشی از روزنامه ان,гузорише аз рӯзномаи эн
ار,ар
س هلند درباره کردستان عراق می‌نویسد,сӣ-и ҳуланд дар бораи курдистони ироқ менависад
بیشتر کردهای عراق زبان عربی‌را دیگر فراموش کرده‌اند و هیچوقت به بقیه عراق سفر نمی‌کنند,бештари курдҳои ироқ забони арабиро дигар фаромӯш кардаанд ва ҳечвақт ба бақияи ироқ сафар намекунанд
آن‌ها خود‌را از نظر فرهنگی با عراقی‌های دیگر مرتبط حس نمی‌کنند,онҳо худро аз назари фарҳангӣ бо ироқиҳои дигар муртабит ҳис намекунанд
درصد بالایی از نسل جدید کردهای عراق دیگر آشنایی زیادی با زبان عربی ندارد,дарсади болое аз насли ҷадиди курдҳои ироқ дигар ошноии зиёде бо забони арабӣ надоранд
دکتر امیر حسن‌پور استاد دانشگاه در دانشگاه تورنتوی کانادا در گفتگویی با بخش کردی صدای آمریکا درباره اوضاع فعلی زبان کردی بویژه در عراق چنین گفت,дуктур амири ҳасанпур устоди донишгоҳ дар донишгоҳи турунтуи конодо дар гуфтугӯе бо бахши курдии садои омрико дар бораи авзоъи феълии забони курдӣ бавижа дар ироқ чунин гуфт
پیش از سال زبان عربی تاثیر و نفوذ اساسی‌را در مطبوعات کردی عراق داشت بگونه‌ای که بیشتر منابع کردی سورانی‌را مطبوعات و انتشارات عربی تشکیل می‌دادند ولی از سال به این سو شرایط فرق کرده‌است,пеш аз соли забони арабӣ таъсиру нуфузи асосиро дар матбуъоти курдии ироқ дошт багунае ки бештари манобеъи курдии сурониро матбуъот ва интишороти арабӣ ташкил медоданд вале аз соли ба ин сӯ шароит фарқ кардааст
از آن سال ارتباط میان ایران و کردستان عراق خیلی بیشتر شده و مرزها امروزه بسیار بازتر از سابق است,аз он сол иртибот миёни эрону курдистони ироқ хеле бештар шуда ва марзҳои имрӯза бисёр бозтар аз собиқ аст
این باعث ایجاد تحولاتی در مطبوعات کردستان عراق شده است,ин боиси эҷоди таҳаввулоте дар матбуъоти курдистони ироқ шудааст
زبان فارسی نقش اصلی‌را به عنوان زبان فرهنگی منطقه شمال عراق به عهده گرفته‌است و شاهد هستیم که بیشتر مطبوعات و نشریه‌های کردی در کردستان عراق برای مطالب خود از منابع فارسی استفاده می‌کنند بویژه در زمینه مسائل روشنفکری فرهنگی و تاریخی,забони форсӣ нақши аслиро ба унвони забони фарҳангии минтақаи шимоли ироқ ба ӯҳда гирифтааст ва шоҳид ҳастем ки бештари матбуъот ва нашрияҳои курдӣ дар курдистони ироқ барои матолиби худ аз манобеъи форсӣ истифода мекунанд бавижа дар заминаи масоъили рӯшанфикрӣ фарҳангӣ ва торихӣ
مثل این که سال نو سال امیدها و بیداری‌ها برای تاجیکستان خواهد بود,мисли ин ки соли нави соли умедҳову бедориҳо барои тоҷикистон хоҳад буд
با آمدن نوروز و آمدن بهار و رستاخیز طبیعت شاید رستاخیز در مغزهای ما هم روی دهد,бо омадани наврӯз ва омадани баҳору растохези табиъат шояд растохез дар мағзҳои мо ҳам рӯй диҳад
باز هم تاریخ ساله‌ی ایران تکرار می‌شود و یک فردی به میدان می‌براید تا در زمان بدبختی و پستی‌های روزگارمان به ما هوشدار دهد که ای مردم,боз ҳам торихи солаи эрон такрор мешавад ва як фарде ба майдон мебарояд то дар замони бадбахтӣ ва пастиҳои рӯзгорамон ба мо ҳушдор диҳад ки эй мардум
اگر بیدار نشوید فردا نابود خواهید شد,агар бедор нашавед фардо нобуд хоҳед шуд
جای شگفتزدگی هم نیست که این بانگ از یک فرد فرهنگی بر می‌آید,ҷойи шигифтзадагӣ ҳам нест ки ин бонг аз як фарди фарҳангӣ бар меояд
شاید متوجه شدید که منظورم برزو عبدالرزاق است,шояд мутаваҷҷеҳ шудед ки манзурам барзу абдурраззоқ аст
چندی از تارنگارهای تاجیکستان درمورد قضیه‌ی نمایشنامه‌ی تازه‌ی برزو عبدالرزاق مطالبی نشر نمودند,чанде аз торнигорҳои тоҷикистон дар мавриди қазияи намоишномаи тозаи барзуи абдурраззоқ матолибе нашр намуданд
در این میان به ویژه از تارنگار یک درویش سپاسگذارم که یک مطلب بسیار خوبی‌را در این زمینه نشر نموده,дар ин миён ба вижа аз торнигори як дарвеш сипосгузорам ки як матлаби бисёр хуберо дар ин замина нашр намуда
تلویزیون فارسی بی‌بی‌سی نیز این مساله‌را خوب پوشش نمود,телевизюни форсии бӣбӣсӣ низ ин масъаларо хуб пӯшиш намуд
همان طوری که برخی از عزیزان حتماً خبر دارند نماشنامه‌ی تئاتری برزو عبدالرزاق با نام دیوانگی,ҳамон тавре ки бархе аз азизон ҳатман хабар доранд намоишномаи теотрии барзуи абдурразоқ бо номи девонагӣ
سال که در آستانه‌ی نوروز اسفند پارسال مارس سال جاری میلادی به نمایش گذاشته شد از طرف وزارت فرهنگ تاجیکستان ممنوع شد,соли ки дар остонаи наврӯз исфанди порсол морси соли ҷории мелодӣ ба намоиш гузошта шуд аз тарафи вазорати фарҳанги тоҷикистон мамнӯъ шуд
علت آن هم دعوت به آشوب و یا انقلاب در این نمایشنامه خوانده شد,иллати он ҳам даъват ба ошӯб ва ё инқилоб дар ин намоишнома хонда шуд
نمایشنامه‌ی مذکور در باره‌ی حوادث انقلاب فرانسه در قرن قرن است که در چشم دولتمندان تاجیکستان شبیه حوادث سال‌های میلادی تاجیکستان نمود,намоишномаи мазкур дар бораи ҳаводиси инқилоби фаронса дар қарни қарни мелодӣ аст ки дар чашми давлатмандони тоҷикистон шабеҳи ҳаводиси солҳои мелодӣ-и тоҷикистон намуд
نام نمایشنامه هم دیوانگی,номи намоишнома ҳам девонагӣ
سال است و سال میلادی خورشیدی در تاجیکستان سال‌های مدهش جنگ داخلی بود,соли аст ва соли мелодӣ хуршедӣ дар тоҷикистон солҳои мудҳиши ҷанги дохилӣ буд
سال میلادی خورشیدی در فرانسه نیز سلطنت دهشت آغاز یافته بود,соли мелодӣ хуршедӣ дар фаронса низ салтанати даҳшат оғоз ёфта буд
اخیراً امروز پس از مذاکرات برزو عبدالرزاق با نمایندگان وزارت فرهنگ این نمایشنامه دوباره با برخی تغییرات و گذشته از همه با تغییر نام آن از دیوانگی,ахиран имрӯз пас аз музокироти барзуи абдурраззоқ бо намояндагони вазорати фарҳанг ин намоишнома дубора бо бархе тағйирот ва гузашта аз ҳама бо тағйири номи он аз девонагӣ
سال به دیوانگی,соли ба девонагӣ
سال روی صحنه آمد,соли рӯйи саҳна омад
آقای عبدالرزاق واقعاً به همه نشان داد که یک شخسیت میهن‌دوست و شخسیست که در اصل نگران آینده‌ی ملت و مرز و بوم است,оқои абдурраззоқ воқеъан ба ҳама нишон дод ки як шахсест меҳандӯст ва шахсест ки дар асл нигарони ояндаи миллат ва марзу бум аст
قسمت‌هایی از سخنان او در تارنمای بی‌بی‌سی و همچنین روی تارنگار یک درویش نشر شد که برایم خیلی جالب بود,қисматҳое аз суханони ӯ дар торнамои бӣбӣсӣ ва ҳамчунин рӯйи торнигори як дарвеш нашр шуд ки бароям хеле ҷолиб буд
سخنانی که گفته شد خقیقت تلخ امروز تاجیکستان است,суханоне ки гуфта шуд ҳақиқати талхи имрӯзи тоҷикистон аст
آقای عبدالرزاق همچنین اشره نمود که مشکل اساسی تاجیکستان بحران حویت است و به گفت او,оқои абдурраззоқ ҳамчунин ишора намуд ки мушкили асосии тоҷикистон бӯҳрони ҳуввият аст ва ба гуфти ӯ
ملت ما غرور خودرا گم کرده‌است,миллати мо ғурури худро гум кардааст
نکته‌ی بسیار جالبی‌را که برزو عبدالرزاق به تصویر کشید گرفتاری مردم تاجیکستان در روسیه است,нуктаи бисёр ҷолиберо ки барзуи абдурразоқ ба тасвир кашид гирифтории мардуми тоҷикистон дар русия аст
با ما چیزی شده بچه‌ها,бо мо чизе шуда бачаҳо
مساله آن نیست که روسیه یا کس دیگر با ما بدرفتاری می‌کند,масъала он нест ки русия ё каси дигар бо мо бадрафторӣ мекунад
با ما چیزی شده,бо мо чизе шуда
با مهاجران کاری ما که یک دیگری‌را می‌خورند,бо муҳоҷирони кории мо ки якдигариро мехӯранд
خودرا پست زده همدیگری‌را می‌خورند,худро паст зада ҳамдигариро мехӯранд
چون,чун
آن‌ها از این جا بار خیانت به یکدیگری‌را بی احترامی‌را با خود می‌برند,онҳо аз ин ҷо бори хиёнат ба якдигариро бе эҳтиромиро бо худ мебаранд
یک اسفرگی‌را می‌کشند کولابی‌ها می‌گویند خَی یهَ اسفرگی بودَیدهَ,як исфарагиро мекушанд кӯлобиҳо мегӯянд хай я исфарагӣ будай-да
یک پنجکنتی‌را می‌کشند می‌گویند خَی پنجکنتی بودَستدهَ,як панҷакентиро мекушанд мегӯянд хай панҷакентӣ будаст-да
کولابیهَ کولابی‌را می‌کشند میگون می‌گیوند کولابیهَ کشتست,кӯлобия кӯлобиро мекушанд мегӯн мегӯянд кӯлобия куштаст
سخن‌های زیادی در این باره می‌گوید که در واقع به هویت و غرور تک‌تک ما بر می‌گردد,суханҳои зиёде дар ин бора мегӯяд ки дар воқеъ ба ҳуввият ва ғурури так-таки мо бар мегардад
در واقع مشکل مردم ما این است که بیرون از خانواده‌ی خود فکر نمی‌کنیم و گاهی منطقه,дар воқеъ мушкили мардуми мо ин аст ки берун аз хонаводаи худ фикр намукунем ва гоҳе минтақа
چرا وقتی سرمان‌را از تنمان جدا می‌کنند کسی اعتراض نمی‌کند,чаро вақте сарамонро аз танамон ҷудо мекунанд касе эътироз намекунад
راستی یادم نیست در کجا خوانده بودم ولی کسی گفته بود که اگر ما با همین راه برویم از یک ملیت جمشیدی به یک ملیت دژومشودی تبدل خواهیم یافت,ростӣ ёдам нест дар куҷо хонда будам вале касе гуфта буд ки агар мо бо ҳамин роҳ биравем аз як миллияти ҷамшедӣ ба як миллияти джумшудӣ табдил хоҳем ёфт
واژه دژومشود برگفته از یک نمایشنامه‌ی تحقیرآمیز علیه تاجیکان در تلویزیون روسیه با نام روشن و دژومشود است,вожаи джумшуд баргирифта аз як намоишномаи таҳқиромез алайҳи тоҷикон дар телевизюни русия бо номи равшан ва джумшуд аст
تا کی در این خواب‌آلودی خواهیم بود,то кай дар ин хоболудӣ хоҳем буд
من هم درست مثل برزو عبدالرزاق مردم‌را به انقلاب یا خود شورش سیاسی دعوت نمی‌نمایم,ман ҳам дуруст мисли барзуи абдурраззоқ мардумро ба инқилоб ё худ шӯриши сиёсӣ даъват наменамоям
همان طوری که پیشتر گفته‌ام – مشکل دولت تاجیکستان از خود ما بر می‌آید چون دولت تاجیکستان جزئی از ملت است دولت بیانگر چه گونگی ملت است,ҳамон тавре ки пештар гуфтаам – мушкили давлати тоҷикистон аз худи мо бар меояд чун давлати тоҷикистон ҷузъе аз миллат аст
دولت در این حال است چون ملت در این حال است,давлат дар ин ҳол аст чун миллат дар ин ҳол аст
ما که خود هویت ملی غرور ملی اتهاد ملی نداریم چه گونه می‌توانیم انتظارآن‌را داشته باشیم که دولت واقعاً مردمی باشد,мо ки худ ҳуввияти миллӣ ғурури миллӣ иттиҳоди миллӣ надорем чӣ гуна метавонем интизори онро дошта бошем ки давлат воқеъан мардумӣ бошад
ما خود مگر می‌دانیم از دولت چه می‌خواهیم,мо худ магар медонем аз давлат чӣ мехоҳем
نه عزیزان,на азизон
ما خود نمی‌دانیم چه می‌خواهیم چون نمی‌دانیم که کیستیم,мо худ намедонем чӣ мехоҳем чун намедонем ки кистем
ما به انقلاب مغزها به انقلاب افکار نیاز داریم,мо ба инқилоби мағзҳо ба инқилоби афкор ниёз дорем
مشکل تاجیکستان در سال‌های میلادی آن بود که دعوت از خواب گران خیز,мушкили тоҷикистон дар солҳои мелодӣ он буд ки даъват аз хоби гарон хез
بود,буд
مردم بخیست ولی بیدار نبود,мардум бихест вале бедор набуд
مردم مثل زامبیهایی که در فیلم‌های هالیوود می‌بینیم بودند و نادیده و ندانسته یکدیگری‌را کشتند,мардум мисли зомбӣ-ҳое ки дар филмҳои ҳоливуд мебинем буданд ва нодидаву надониста якдигариро куштанд
آری دوستان,оре дӯстон
از خواب گران خیستن به دردمان نمی‌خورد,аз хоби гарон хестан ба дардамон намехӯрад
ما می‌باید از خواب گران بیدار شویم,мо мебояд аз хоби гарон бедор шавем
بدانیم کیستیم و از کجا می‌آییم,бидонем кистему аз куҷо меоем
تنها آن زمان می‌توانیم درک کنیم که کجا باید رفت,танҳо он замон метавонем дарк кунем ки куҷо бояд рафт
امیدوارم که این بانگ حقیقت به گوش مردم برسد و مغزهای خوابیده‌ی ما بیدار شوند,умедворам ки ин бонги ҳақиқат ба гӯши мардум бирасад ва мағзҳои хобидаи мо бедор шаванд
حکومت هم باید با این بانگ بیدار شود چون حکومت هم قسمتی از مردم است,ҳукумат ҳам бояд бо ин бонг бедор шавад чун ҳукумат ҳам қисмате аз мардум аст
ساعاتی تا تحویل سال نو مانده,соъоти то таҳвили соли нави монда
می‌خواستم همه‌ی شما هم‌میهنان عزیزرا با این جشن پرشکوه و باستانی مبارکباد بگویم,мехостам ҳамаи шумо ҳаммеҳанони азизро бо ин ҷашни пуршукӯҳ ва пуршукӯҳ ва бостонӣ муборакбод бигӯям
امیدوارم که این سال نو برای تک تک شما سال خوشی شادی فراوانی و سلامتی باشد,умедворам ки ин соли нав барои так таки шумо соли хушӣ шодӣ фаровонӣ ва саломатӣ бошад
این سال‌را همه‌ی ما با امیدهایی در قلبمان پیشواز می‌گیریم و امید بر خدای‌را که همه‌ی این امیدهای نیک ما به واقعیت تبدل بیابند,ин солро ҳамаи мо бо умедҳое дар қалбамон пешвоз мегирем ва умед бар худойро ки ҳамаи ин умедҳои неки мо ба воқеъият табдил ёбанд
می‌خواستم در این لحظات از ریشه‌های جشن نوروز طبق روایت حکیم ابوالقاسم فردوسی بزرگوار یادآور شویم,мехостам дар ин лаҳазот аз решаҳои ҷашни наврӯз тибқи ривояти ҳаким абулқосими фирдавсӣ ёдовар шавем
در شاهنامه آمده که نوروزرا جمشید شاه به میان آورد,дар шоҳнома омада ки наврӯзро ҷамшедшоҳ ба миён овард
این شاه داددهنده و خردمند پس از پنجاه سال حکمرانی نوروزرا به میان آورد,ин шоҳ доддиҳанда ва хирдманд пас аз панҷоҳ соли ҳукмронӣ наврӯзро ба миён овард
چنان که فردوسی بزرگوار فرموده,чунон ки фирдавсии бузургвор фармуда
چنین سال پنجه برنجید نیز,чунин сол панҷаҳ биранҷид низ
ندید از هنر بر خرد بسته چیز,надид аз ҳунар бар хирад баста чиз
همه کردنی‌ها چو آمد به جای,ҳама карданиҳо чу омад ба ҷой
ز جای مهی برتر آورد پای,зи ҷойи меҳе бартар овард пой
به فرّ کیانی یکی تخت ساخت,ба фарри каёнӣ яке тахт сохт
چه مایه بدو گوهر اندر نشاخت,чӣ моя бадӯ гавҳар андар нишохт
که چون خواستی دیو برداشتی,ки чун хостӣ дев бардоштӣ
ز هامون به گردون برافراشتی,зи ҳомун ба гардун барафроштӣ
چو خورشید تابان میان هوا,чу хуршеди тобон миёни ҳаво
نشسته بر او شاه فرمانروا,нишаста бар ӯ шоҳи фармонраво
جهان انجمن شد بر آن تخت اوی,ҷаҳон анҷуман шуд бар он тахти ӯй
شگفتی فرومانده از بخت اوی,шигифтӣ фурӯмонда аз бахти ӯй
به جمشیدبر گوهر افشاندند,ба ҷамшедбар гавҳар афшонданд
مران روزرا روز نو خواندند,мар-он рӯзро рӯзи нав хонданд
سر سال نو هرمز فرودین,сари соли нав ҳармуз фарвадин
برآسود از رنج و ز درد و کین,баросуд аз ранҷу зи дарду кин
بزرگان به شادی بیاراستند,бузургон ба шодӣ биёростанд
می و جام و رامشگران خواستند,майу ҷому ромишгарон хостанд
چنین جشن فرّخ از آن روزگار,чунин ҷашни фаррух аз он рӯзгор
به ما ماند از آن خسروان یادگار,ба мо монд аз он хусравон ёдгор
در این سال و همیشه شاد و خرم و فرخنده باشید؛ و نور ایزدی همیشه با شما باد,дар ин сол ва ҳамеша шоду хуррам ва фархунда бошед ва нури эзадӣ ҳамеша бо шумо бод
